{
  "snapshot_id": "orders-new",
  "task_id": "T004",
  "state": "orders-new",
  "captured_at_utc": "2026-10-14T13:10:21.516292+00:00",
  "viewport": {
    "width": 1280,
    "height": 800
  },
  "html_sha256": "7598d809cb24d177f117e0f39eaeb45ec954c6412d559d10cff7bc93a2eed60a",
  "provenance": {
    "git_commit": "d53970fd717b5f5e1840d680f10fe5cd0af88b53",
    "git_status": " M .gitignore\n D docs/weekly/W2-report.pdf\n M docs/weekly/W2.md\n M scripts/build_w2_report.py\n?? docs/DoAn_Version_W2.docx\n?? docs/dom-snapshot-v0.1.md\n?? docs/weekly/W2-report.docx\n?? docs/weekly/W3.md\n?? dom_snapshot/\n?? notebooks/\n?? results/w3/\n?? tests/test_dom_snapshot.py\n",
    "source_hashes_lf": {
      "app/__init__.py": "e3b0c44298fc1c149afbf4c8996fb92427ae41e4649b934ca495991b7852b855",
      "app/db.py": "ec71d79904fb1f047ee6118304a7de3a55fca8d18ff176c474069954b192297d",
      "app/main.py": "5567eb235296985f53a1ce43e820ca125e61ca01aac376b96239ae914b93284b",
      "app/routes/__init__.py": "e3b0c44298fc1c149afbf4c8996fb92427ae41e4649b934ca495991b7852b855",
      "app/routes/customers.py": "53affccbe40260f269669a68e1d91a1e07465aebbecff823cdd3e2d900347197",
      "app/routes/orders.py": "3e0d55eee4ae1ed93a86a7912a08669fefc32c76bb4ea5c3de93c2e9ca671a0e",
      "app/routes/tickets.py": "4b72a155c5b27932cc81aea8cd6f6ae53c0a4489b1db3b7f420ed36c2c40be1c",
      "app/seed.py": "637c446270aded35bada74d6e647de64fdf0f93ba45739412ee79dae6dd90928",
      "app/static/orders.js": "c02b29501acf35b6b4aec3686f2049db1d4f33e10af65516742184f1fb87da41",
      "app/static/style.css": "576b48f21f58abcd348c17cffa643329981e82e54e7abe5b2c091d24d630d3b5",
      "app/templates/base.html": "22614442fa83522ab82cda28c9578d37547b627dd413845a65f94914e92b8dc8",
      "app/templates/customers/detail.html": "7dd1c76a479660044d9f68b9c1e93a09001e234e80e445af79cd3bf8df5d0cff",
      "app/templates/customers/edit.html": "c08d55e0060d35187a39a55235fc566e2f57d473a9641318f2a91f94d47a12ed",
      "app/templates/customers/list.html": "21afd5993e6a1d2adcc43b54e697fe5b9b918af44ac318dc8da077e31b73fd8c",
      "app/templates/customers/new.html": "b2457740a0f703c7fb6ac162e85019de6c0aa87e4116afc113a7ab5992fe555c",
      "app/templates/index.html": "55d93b6da59c7056deb042043c1ac764e319444ac4f066713e943f435bf26d94",
      "app/templates/orders/detail.html": "1ff5dabd89568c6c8af7b9c07e51ed4996a50a08aa11663accf47e8ba5cd79e6",
      "app/templates/orders/list.html": "8dc0e463626c9056051427b6ac5cbaccd656e651aa6263ff031c34a42e20364b",
      "app/templates/orders/new.html": "2ca3755b16b131408c156587d86833cacda14b2d0eee0ee126f7e3ffca70b1e8",
      "app/templates/tickets/detail.html": "22916f5cd9c3cbde9b1824072b5212224e1dfeea029e1cf335f428d90048f4ed",
      "app/templates/tickets/list.html": "a7ad40fd20c7d6eb8f76a3b69bca9428a022966a3891ee3588113dfb0ec144c1",
      "app/templates/tickets/new.html": "0c5ee855144ef1c3964ecf48be827948f7e92fcd876cd85d894af197cf3889f9",
      "dom_snapshot/__init__.py": "ddc37186ab2aebf739e36d5961b4b0a6f440533d338da524943842840c632cc0",
      "dom_snapshot/capture.py": "c8d33f4d77cd6bbd525bdbd6dc704e9a4ae30a9910b613f48fb47d33d702dd65",
      "dom_snapshot/cases.py": "35539e372e4ad0e4e6907e778dcffc649d6c4c534ffb619da8d5547e1aaaf67d",
      "dom_snapshot/extract.js": "02f49b8bbcf250a68423f72031c94b3b58e563727a7e6e3b63b71eb9d3e857af",
      "dom_snapshot/parser.py": "6df1363420bacf0d7fe5833f6bd4521fee142718a024d1135de3cfa4ba89641a",
      "dom_snapshot/run.py": "11505944678e94653511e14a4c4f2c6ffc8ac634a1b73ab9ca85526577b28d52",
      "dom_snapshot/schema_v0.1.json": "92c07a33d53265e38524ec66a53a8edf1629a0e1239458bbb9925ef7b68b633f"
    },
    "seed_sha256": "638bb0fa96d8e603f7604d40b07d6703b3d0438e9c61205de45cb8c04dddf888",
    "mutation": "M0",
    "schema_status": "proposal awaiting candidate-generator integration",
    "browser_version": "153.0.8010.12"
  },
  "schema_version": "0.1",
  "url": "http://127.0.0.1:59910/orders/new",
  "title": "Tạo đơn | MiniBiz Benchmark",
  "elements": [
    {
      "element_id": "e1",
      "parent_id": null,
      "tag": "html",
      "text": "Tạo đơn | MiniBiz Benchmark MiniBiz Ứng dụng benchmark nghiệp vụ Web Khách hàng · Đơn hàng · Hỗ trợ Tạo đơn hàng Khách hàng Chọn khách hàng Trần Hoa — tran.hoa@example.com Nguyễn Văn Dũng — nguyen.dung@example.com Phạm Thu Hà — pham.ha@example.com Võ Thanh Tâm — vo.tam@example.com Sản phẩm 1 Sản phẩm Chọn sản phẩm SKU-100 — Bàn phím SKU-205 — Chuột máy tính Số lượng Xóa dòng Thêm dòng Xác nhận tạo đơn Hủy",
      "attributes": {
        "lang": "vi"
      },
      "label": null,
      "name_hint": null,
      "visible": true,
      "enabled": true,
      "readonly": false,
      "value": null,
      "checked": null,
      "selected": null,
      "bounding_box": {
        "x": 0,
        "y": 0,
        "width": 1280,
        "height": 705.796875
      },
      "locator": {
        "strategy": "xpath",
        "value": "/*[local-name()='html'][1]"
      }
    },
    {
      "element_id": "e2",
      "parent_id": "e1",
      "tag": "head",
      "text": "Tạo đơn | MiniBiz Benchmark",
      "attributes": {},
      "label": null,
      "name_hint": null,
      "visible": false,
      "enabled": true,
      "readonly": false,
      "value": null,
      "checked": null,
      "selected": null,
      "bounding_box": {
        "x": 0,
        "y": 0,
        "width": 0,
        "height": 0
      },
      "locator": {
        "strategy": "xpath",
        "value": "/*[local-name()='html'][1]/*[local-name()='head'][1]"
      }
    },
    {
      "element_id": "e3",
      "parent_id": "e2",
      "tag": "meta",
      "text": "",
      "attributes": {
        "charset": "UTF-8"
      },
      "label": null,
      "name_hint": null,
      "visible": false,
      "enabled": true,
      "readonly": false,
      "value": null,
      "checked": null,
      "selected": null,
      "bounding_box": {
        "x": 0,
        "y": 0,
        "width": 0,
        "height": 0
      },
      "locator": {
        "strategy": "xpath",
        "value": "/*[local-name()='html'][1]/*[local-name()='head'][1]/*[local-name()='meta'][1]"
      }
    },
    {
      "element_id": "e4",
      "parent_id": "e2",
      "tag": "meta",
      "text": "",
      "attributes": {
        "name": "viewport",
        "content": "width=device-width, initial-scale=1.0"
      },
      "label": null,
      "name_hint": null,
      "visible": false,
      "enabled": true,
      "readonly": false,
      "value": null,
      "checked": null,
      "selected": null,
      "bounding_box": {
        "x": 0,
        "y": 0,
        "width": 0,
        "height": 0
      },
      "locator": {
        "strategy": "xpath",
        "value": "/*[local-name()='html'][1]/*[local-name()='head'][1]/*[local-name()='meta'][2]"
      }
    },
    {
      "element_id": "e5",
      "parent_id": "e2",
      "tag": "title",
      "text": "Tạo đơn | MiniBiz Benchmark",
      "attributes": {},
      "label": null,
      "name_hint": null,
      "visible": false,
      "enabled": true,
      "readonly": false,
      "value": null,
      "checked": null,
      "selected": null,
      "bounding_box": {
        "x": 0,
        "y": 0,
        "width": 0,
        "height": 0
      },
      "locator": {
        "strategy": "xpath",
        "value": "/*[local-name()='html'][1]/*[local-name()='head'][1]/*[local-name()='title'][1]"
      }
    },
    {
      "element_id": "e6",
      "parent_id": "e2",
      "tag": "link",
      "text": "",
      "attributes": {
        "rel": "stylesheet",
        "href": "http://127.0.0.1:59910/static/style.css"
      },
      "label": null,
      "name_hint": null,
      "visible": false,
      "enabled": true,
      "readonly": false,
      "value": null,
      "checked": null,
      "selected": null,
      "bounding_box": {
        "x": 0,
        "y": 0,
        "width": 0,
        "height": 0
      },
      "locator": {
        "strategy": "xpath",
        "value": "/*[local-name()='html'][1]/*[local-name()='head'][1]/*[local-name()='link'][1]"
      }
    },
    {
      "element_id": "e7",
      "parent_id": "e1",
      "tag": "body",
      "text": "MiniBiz Ứng dụng benchmark nghiệp vụ Web Khách hàng · Đơn hàng · Hỗ trợ Tạo đơn hàng Khách hàng Chọn khách hàng Trần Hoa — tran.hoa@example.com Nguyễn Văn Dũng — nguyen.dung@example.com Phạm Thu Hà — pham.ha@example.com Võ Thanh Tâm — vo.tam@example.com Sản phẩm 1 Sản phẩm Chọn sản phẩm SKU-100 — Bàn phím SKU-205 — Chuột máy tính Số lượng Xóa dòng Thêm dòng Xác nhận tạo đơn Hủy",
      "attributes": {},
      "label": null,
      "name_hint": null,
      "visible": true,
      "enabled": true,
      "readonly": false,
      "value": null,
      "checked": null,
      "selected": null,
      "bounding_box": {
        "x": 0,
        "y": 0,
        "width": 1280,
        "height": 705.796875
      },
      "locator": {
        "strategy": "xpath",
        "value": "/*[local-name()='html'][1]/*[local-name()='body'][1]"
      }
    },
    {
      "element_id": "e8",
      "parent_id": "e7",
      "tag": "header",
      "text": "MiniBiz Ứng dụng benchmark nghiệp vụ Web",
      "attributes": {
        "class": "site-header"
      },
      "label": null,
      "name_hint": null,
      "visible": true,
      "enabled": true,
      "readonly": false,
      "value": null,
      "checked": null,
      "selected": null,
      "bounding_box": {
        "x": 0,
        "y": 0,
        "width": 1280,
        "height": 75.390625
      },
      "locator": {
        "strategy": "xpath",
        "value": "/*[local-name()='html'][1]/*[local-name()='body'][1]/*[local-name()='header'][1]"
      }
    },
    {
      "element_id": "e9",
      "parent_id": "e8",
      "tag": "div",
      "text": "MiniBiz Ứng dụng benchmark nghiệp vụ Web",
      "attributes": {
        "class": "container"
      },
      "label": null,
      "name_hint": null,
      "visible": true,
      "enabled": true,